"follow","〜（の後）に続く\r\n〈指示・方針など〉\r\nに従う","follow her advice\r\n彼女の助言に従う"
"consider","〜を考慮する","consider the problem seriously\r\nその問題を真剣に考える"
"increase","増える；〜を増やす","increase by 20 percent\r\n20%増加する"
"expect","〜を予期する","expect you to arrive soon\r\n君がすぐ来ることを予期する"
"decide","〜することを決意する","decide to tell the truth\r\n真実を語る決意をする"
"develop","発達する;\r\n〜を発達させる","develop a unique ability\r\n特異な能力を発達させる"
"provide","〜を供給する,\r\n与える","provide him with information\r\n彼に情報を与える"
"continue","続く;\r\n（〜を）続ける\r\n（=go on，carry on）","continue to grow fast\r\n急速に成長し続ける"
"include","〜を含む，含める","The list includes his name.\r\nリストは彼の名前を含んでいる"
"remain","〈ある状態の〉\r\nままでいる","remain silent\r\n黙ったままでいる"
"reach","〜に着く\r\n（=arrive at）;\r\n〜に達する","reach the mountain top\r\n山頂に達する"
"allow","〜を許可する","allow him to go out\r\n彼に外出を許可する"
"force","〜を強制する","be forced to leave\r\n立ち退きを強制される"
"offer","〜を申し出る","offer help to the poor\r\n貧しい人に援助を申し出る"
"realize","〜を悟る","realize the error\r\nその間違いを悟る"
"require","〜を必要とする\r\n（=need）","require more attention\r\nもっと注意を必要とする"
"suggest","〜と提案する\r\n〜をほのめかす","suggest a new way\r\n新しいやり方を提案する"
"worry","心配する","worry about money\r\nお金のことを心配する"
"wonder","（+wh/if節）\r\n〜かと疑問に思う","wonder where he has gone\r\n彼はどこに行ったのかと思う"
"cost","〈費用〉を要する","The car cost me $50,000.\r\nその車には5万ドルかかった。"
"tend","（tend to V)\r\nVする傾向がある,\r\nVしがちである\r\n","tend to get angry\r\n腹を立てがちである"
"depend","（depend on A）\r\nAに依存する,\r\nAしだいで決まる","Everything depends on him.\r\nすべては彼しだいだ。"
"share","〜を分け合う,\r\n共有する","share the room with a friend\r\n友人と部屋を共有する"
"demand","〜を要求する","demand more money\r\nさらに金を要求する"
"support","〜を支持する\r\n〈家族など〉を養う\r\n〜を立証する","support the President\r\n大統領を支持する"
"hire","〜を雇う","limit the speed\r\n速度を制限する"
"regard","（regard A as B)\r\nAをBだと思う,\r\nみなす","regard him as a friend\r\n彼を友達とみなす"
"base","(A be based on B)\r\nAがBに\r\n基づいている","This story is based on fact.\r\nこの話は事実に基づいている。"
"improve","〜を向上させる","improve my English ability\r\n英語力を向上させる"
"recognize","〜を認める","recognize the importance\r\n重要性を認める"
"notice","〜に気づく","notice the color change\r\n色彩の変化に気づく"
"suppose","〜だと思う","be supposed to wear a seat belt\r\nシートベルトを締めることになっている"
"raise","〜を上げる\r\n〜を育てる（=bring up)\r\n〈問題など〉を提起する\r\n［名］賃上げ(=pay raise)","raise three children\r\n3人の子供を育てる"
"prefer","〜をより好む","prefer tea to coffee\r\nコーヒーよりお茶を好む"
"enter","〈場所・学校〉\r\nに入る","enter college at fifteen\r\n15歳で大学に入る"
"suffer","〈苦痛・損害など〉\r\nを経験する，受ける;\r\n（病気などで）苦しむ","suffer heavy damage\r\nひどい損害を受ける"
"describe","〜を描写する,\r\n〜の特徴を説明する","describe the lost bag\r\nなくしたバッグの特徴を言う"
"prevent","〜をさまたげる","prevent him from going out\r\n彼が外出するのをさまたげる"
"reduce","〜を減らす","reduce weight\r\n体重を減らす"
"mistake","〜を誤解する,\r\nまちがえる","mistake salt for sugar\r\n塩を砂糖と間違える"
"prepare","（〜の）準備をする\r\n（+for)","prepare a room for a guest\r\n客のために部屋を準備する"
"encourage","〈人を〉はげます","encourage children to read\r\n子供に読書をすすめる"
"prove","〜だとわかる\r\n(=turn out)\r\n〜を証明する","prove to be true\r\n本当だとわかる"
"join","〜に参加する\r\n(=take part in)","join the baseball club\r\n野球部に入る"
"treat","〜をあつかう","treat him like a child\r\n彼を子どものように扱う"
"establish","〜を確立する,\r\n設立する\r\n(=found)","establish a new company\r\n新会社を設立する"
"relate","関係がある","stress-related illness\r\nストレスと関係のある病気"
"compare","〜を比較する\r\n〜をたとえる","compare Japan with China\r\n日本と中国を比較する"
"spread","〜を広げる;\r\n広がる","spread the tablecloth\r\nテーブルクロスを広げる"
"refer","(refer to A)\r\nAを指示する","What does this word refer to?\r\nこの語は何を指示するか"
"supply","〜を供給する","supply the city with water\r\nその都市に水を供給する"
"gain","〜を得る","gain useful knowledge\r\n有益な知識を得る"
"destroy","〜を破壊する","destroy the Berlin Wall\r\nベルリンの壁を破壊する"
"apply","当てはまる\r\n申し込む","apply the rule to every case\r\n全ての場合に規則をあてはめる"
"seek","〜を求める","seek help from the police\r\n警察に助けを求める"
"search","（search for A)\r\nAを捜す","search for the stolen car\r\n盗難車を捜す"
"claim","〜と主張する\r\n〜を（当然の権利\r\nとして）要求する","He claims that he saw a UFO.\r\n彼はUFOを見たと主張する"
"draw","〜を引っぱる\r\n〈図・絵〉を\r\n（線で）描く","draw a map\r\n地図を描く"
"introduce","〜を紹介する","introduce you to my friend\r\n友人に君を紹介する"
"refuse","〈申し出など〉\r\nを断る","refuse to kiss him\r\n彼にキスするのを拒む"
"mention","〜について述べる","Never mention it again.\r\n二度とそのことを口にするな"
"judge","〜を判断する","judge a person by his looks\r\n人を外見で判断する"
"approach","（〜に）接近する\r\n〈問題など〉に取り組む\r\n［名］（研究などの）方法","A typhoon is approaching Japan.\r\n台風が日本に接近している"
"admit","〈自分に不利・\r\n不快なこと〉を認める（+that〜)","admit a mistake\r\n誤りを認める"
"reflect","〜を反映する,反射する\r\n(reflect on A)\r\nAについてよく考える","reflect the mood of the times\r\n時代の気分を反映する"
"perform","〜を行う,\r\n〜を遂行する\r\n(=carry out)","perform the work\r\n仕事を遂行する"
"bore","〈人〉をうんざりさせる","a very boring movie\r\nすごく退屈な映画"
"survive","生き残る","survive in the jungle\r\nジャングルで生き残る"
"represent","〜を表す","Words represent ideas.\r\n言葉は考えを表す。"
"argue","〜と主張する\r\n(+that〜)","argue that he is wrong\r\n彼は間違っていると主張する"
"grant","〜を認める\r\n(=admit)\r\n〜を与える","take freedom for granted\r\n自由を当然と考える"
"indicate","〜を指し示す","The data indicate that he is right.\r\nデータは彼が正しいことを示している"
"belong","所属している","He belongs to the CIA.\r\n彼はCIAに属している"
"acquire","〈言語,技術など〉\r\nを習得する","acquire a language\r\n言語を習得する"
"reply","返事をする","reply to his letter\r\n彼の手紙に返事をする"
"feed","〜にエサをやる,\r\n〜を養う","feed a large family\r\n大ぜいの家族を養う"
"escape","逃げる","escape from the problem\r\n問題から逃避する"
"replace","〜に取って代わる,\r\n〜を取り替える","replace the old system\r\n古い制度に取って代わる"
"reveal","〜を明らかにする","reveal a surprising fact\r\n驚くべき事実を明らかにする"
"surround","〜を取り囲む","Japan is surrounded by the sea.\r\n日本は海に囲まれている"
"suit","〜に合う","The job suits you.\r\nその仕事は君に合っている"
"estimate","〈数量〉を推定する","the estimated population of Japan\r\n日本の推定人口"
"aim","(aim at A)\r\nAをねらう","aim at the target\r\n標的をねらう"
"earn","〈金〉をもうける,\r\nかせぐ","earn money for the family\r\n家族のためにお金をかせぐ"
"decline","衰退する，低下する\r\n〜を辞退する","My memory began to decline.\r\n記憶力が低下し始めた"
"afford","〜をする［持つ］\r\n余裕がある","can""t afford to buy a Ford\r\nフォードの車を買う余裕がない"
"confuse","〈人〉を当惑させる","be confused by her anger\r\n彼女の怒りに当惑する"
"graduate","(graduate from A)\r\nAを卒業する","graduate from high school\r\n高校を卒業する"
"vary","変わる,\r\nさまざまである","vary from country to country\r\n国によって変わる"
"remove","〜を移す，取り去る","remove the cover\r\nカバーを取り除く"
"insist","〜と（強く）主張する,\r\n言い張る","insist on going there alone\r\n一人でそこに行くと言い張る"
"examine","〜を調査する","examine every record\r\nあらゆる記録を調べる"
"remind","(remind A of B)\r\nAにBのことを\r\n思い出させる","remind him of the promise\r\n彼に約束を思い出させる"
"contribute","(to+A)Aに貢献する;\r\nAの一因となる\r\n(+A to B)AをBに寄付する","contribute to world peace\r\n世界平和に貢献する"
"warn","〈人〉に警告する","warn him of the danger\r\n彼に危険を警告する"
"connect","〜をつなぐ","connect Honshu with Shikoku\r\n本州と四国をつなぐ"
"match","〜に匹敵する\r\n〜に調和する\r\n(=go with)","match him in power\r\n力で彼に匹敵する"
"focus","焦点を合わせる","focus on the topic\r\nその話題に焦点を合わせる"
"reject","〈提案など〉を断る","reject the proposal\r\n提案を拒否する"
"convince","〈人〉を納得させる,\r\n確信させる","convince him of our success\r\n彼に成功を確信させる"
"associate","(associate A with B)\r\nAをBに関連づける,\r\nAからBを連想する","Red is associated with danger.\r\n赤は危険と結びつけられる"
"rush","急いで行く","rush into the hospital\r\n病院へ急いで行く"
"stress","〜を強調する","stress the need for information\r\n情報の必要性を強調する"
"attract","〈人・注意〉\r\nを引きつける","attract his attention\r\n彼の注意を引きつける"
"rely ","(rely on［upon］A)\r\nAに頼る","rely on their power\r\n彼らの力に頼る"
"respond","(respond to A)\r\nAに返答する","respond to questions\r\n質問に答える"
"threaten","〜を脅迫する","threaten to kill the girl\r\nその娘を殺すと脅迫する"
"adopt","〈理論・技術など〉\r\nを採用する","adopt a new system\r\n新しいシステムを採用する"
"shake","〜を振る","shake the bottle well\r\nビンをよく振る"
"hurt","〜を傷つける","hurt her feelings\r\n彼女の気持を傷つける"
"operate","〈機械などが〉作動する\r\n〈機械など〉を操作する\r\n手術する(+on)","operate a computer with a mouse\r\nマウスでコンピュータを操作する"
"extend","〜を広げる，延長する","extend my stay for two days\r\n滞在を二日延長する"
"blame","〜を非難する,\r\n〜のせいにする","blame others for the failure\r\n失敗を他人のせいにする"
"consist","(consist of A)\r\nAで構成されている","The book consists of six lessons.\r\nその本は6課で構成されている。"
"persuade","〜を説得する","persuade them to go back\r\n彼らを説得して帰らせる"
"admire","〜に感心する","admire her English ability\r\n彼女の英語力に感服する"
"disappoint","〜を失望させる","be disappointed with the test results\r\n試験の結果に失望する"
"expand","（〜を）拡大する","expand the market\r\n市場を拡大する"
"preserve","〜を保護する,\r\n〜を保つ","preserve forests\r\n森林を保護する"
"struggle","苦闘する，もがく","struggle to get free\r\n自由になろうともがく"
"arrange","〈会合など〉の\r\n手はずを整える\r\n〜を配列する\r\n","arrange the meeting\r\n会議の手はずを整える"
"disturb","〈人・仕事など〉\r\nをさまたげる\r\n(=interrupt)","disturb his sleep\r\n彼の睡眠を妨げる"
"employ","〜を雇う\r\n〈方法・言葉など〉\r\nを用いる(=use)","employ her as a typist\r\nタイピストとして彼女を雇う"
"engage","(engage in A)\r\nA（仕事・活動など）\r\nに従事する,\r\nAを行う","engage in volunteer activities\r\nボランティア活動に従事する"
"abandon","〜を捨てる","an abandoned child\r\n捨てられた子供"
"display","〜を展示する;\r\n〜を表す","display a talent\r\n才能を誇示する"
"encounter","〜に偶然出会う","encounter many difficulties\r\n数々の困難に出会う"
"exhaust","〈人〉を疲れはてさせる","be too exhausted to speak\r\n口もきけないほど疲れはてている"
"bother","〈人〉に面倒をかける,\r\n困らせる\r\n（〜を）気にする","I don""t want to bother you.\r\nあなたを困らせたくない"
"concentrate","集中する","concentrate on what he is saying\r\n彼の話に集中する"
"adapt","〜を適応させる,\r\n適応する","adapt to the change\r\n変化に適応する"
"puzzle","〜を当惑させる\r\n(=confuse)","be puzzled by the problem\r\nその問題に頭を悩ませる"
"appeal","(appeal to A)\r\nA〈理性・感情など〉に訴える\r\n〈人〉を引きつける\r\n［名］魅力","appeal to feelings\r\n感情に訴える"
"combine","〜を結合させる","combine music and drama\r\n音楽と演劇を結合させる"
"delay","〜を遅らせる","delay his arrival\r\n彼の到着を遅らせる"
"repair","〜を修理する","repair the car\r\n車を修理する"
"fascinate","〈人〉を夢中にさせる","a fascinating voice\r\n魅力的な声"
"devote","〜をささげる","He devoted himself to his work.\r\n彼は仕事に身をささげた。"
"import","〜を輸入する","cars imported from America\r\nアメリカから輸入された車"
"remark","（〜と）述べる","remark that he is kind\r\n彼は親切だと述べる"
"reserve","〜を予約する,\r\n〜を取っておく\r\n(=set aside)","reserve a room at a hotel\r\nホテルの部屋を予約する"
"amaze","〜を驚嘆させる","amazing speed\r\n驚異的な速さ"
"frighten","〈人〉をおびえさせる","be frightened of death\r\n死を恐れる"
"release","〜を解放する\r\n〜を発表する","release him from work\r\n仕事から彼を解放する"
"rent","〈家・車など〉\r\nを賃借りする","rent an apartment\r\nアパートを借りる"
"recover","(recover from A)\r\nA（病気など）から\r\n回復する","recover from illness\r\n病気から回復する"
"suspect","〜ではないかと思う\r\n(=suppose)\r\n〈人・もの〉を疑う","suspect him of being a spy\r\n彼をスパイではないかと疑う"
"deliver","〜を配達する，渡す\r\n〈講義など〉をする","deliver a message to a friend\r\n友達に伝言を渡す"
"identify","〜の正体をつきとめる,\r\n(identify with A)\r\nAと共感する","identify the body\r\n死体の身元を確認する"
"locate","（be located in\r\n［on,at］A)\r\n（Aに）位置する","The office is located in the area.\r\nオフィスはその地域にある"
"manufacture","〜を製造する","a car manufacturing company\r\n車を製造する会社"
"occupy","〈場所・地位など〉\r\nを占める","occupy a good position\r\nよい地位を占める"
"own","〜を所有している","own five cars\r\n5台の車を所有している"
"expose","（expose A to B)\r\nAをBにさらす","expose the skin to sunlight\r\n日光に肌をさらす"
"conclude","〜と結論づける","conclude that he was killed\r\n彼は殺されたという結論を下す"
"cure","〜を治療する","cure him of his cold\r\n彼のカゼを治す"
"perceive","〜を知覚する","perceive danger\r\n危険に気づく"
"ban","（公式に）\r\n〜を禁止する","freeze to death\r\n凍えて死ぬ"
"alarm","〜をぎょっとさせる,\r\nおびえさせる(=scare)","The noise alarms the dog.\r\nその音が犬をおびえさせる。"
"derive","由来する\r\n","This word derives from Latin.\r\nこの語はラテン語に由来する。"
"neglect","〜を無視する，怠る\r\n〈子供など〉の\r\n世話をしない","neglect human rights\r\n人権を無視する"
"adjust","〈環境に〉慣れる\r\n（=adapt),\r\n調節して合わせる","adjust to a new school\r\n新しい学校に慣れる"
"shift","〜を変える","shift gears\r\nギアを変える"
"embarrass","〜を困惑させる,\r\n〜に恥ずかしい\r\n思いをさせる","be embarrassed about the mistake\r\nその間違いが恥ずかしい"
"approve","〜を承認する","approve of their marriage\r\n二人の結婚を承認する"
"commit","〈罪など〉を犯す","commit a serious error\r\n重大な誤りを犯す"
"stretch","〜を広げる","stretch my legs\r\n足を広げる"
"participate","(participate in A)\r\nAに参加する","participate in the meeting\r\nその会議に参加する"
"impose","(impose A on B)\r\nAをBに課す,\r\n押しつける","impose rules on students\r\n学生に規則を押しつける"
"owe","(owe A to B)\r\nAことはBのおかげだ","I owe my success to you.\r\n私の成功は、あなたのおかげだ。"
"celebrate","〈特定の日・できごと〉\r\nを祝う","celebrate his birthday\r\n彼の誕生日を祝う"
"emerge","〈隠れていたものが〉\r\n現れる(=appear)","A new problem has emerged.\r\n新たな問題が出現した"
"urge","〜に強く迫る,\r\n〜を説得する","urge him to stop smoking\r\n禁煙するよう彼を説得する"
"seat","(be seated)\r\n座っている","be seated on the bench\r\nベンチで座っている"
"injure","〜を傷つける","be injured in the accident\r\nその事故で負傷する"
"imply","〜を（暗に）\r\n意味する","What does her smile imply?\r\n彼女の微笑は何を意味するのか。"
"explain","〜を説明する","`explain` the answer to students\r\n学生に答を説明する"
"accept","〜を受け入れる","accept the truth as it is\r\nありのまま事実を受け入れる"
"produce","〜を生産する\r\n〜を作る","produce a new car model\r\n新型車を生産する"
"exist","存在する","Does God really exist?\r\n神は本当に存在するのか。"
"occur","起こる(=happen)","This problem often occurs.\r\nこの問題はしばしば起こる"
"express","〜を表現する\r\n［名］急行","express my true feelings\r\n本当の気持ちを表現する"
"add","(add A to B)\r\nBにAを加える\r\n〈言葉を〉付け加える","add some milk to the soup\r\nスープにミルクを加える"
"avoid","〜を避ける","avoid meeting people\r\n人に会うのを避ける"
"marry","〜と結婚する","marry Mary\r\nメアリと結婚する"
"protect","(protect A from B)\r\nBからAを守る","protect children from danger\r\n危険から子供たちを守る"
"affect","〜に影響する\r\n(=influence)","Alcohol affects the brain.\r\nアルコールは脳に影響する。"
"determine","〜を決定する\r\n決心する\r\n(=decide)","determine your future\r\n君の未来を決定する"
"solve","〜を解決する","solve the problem\r\n問題を解決する"
"contain","〜を含んでいる\r\n〈SにO〉が入っている","This book contains 2000 words.\r\nこの本には2000の単語が入っている."
"discuss","〜を議論する\r\n(=talk about)","discuss the problem with him\r\n彼とその問題を議論する"
"ignore","〜を無視する","ignore the doctor""s advice\r\n医者の忠告を無視する"
"guess","〜を推測する\r\n〜と考える\r\n(=suppose)","guess how old she is\r\n彼女の年を推測する"
"exchange","(exchange A for B)\r\nAをBに交換する","exchange yen for dollars\r\n円をドルに交換する"
"satisfy","〜を満たす\r\n〜を満足させる","satisfy the needs of students\r\n学生の要求を満たす"
"complain","(complain about A)\r\nAのことで苦情を言う","complain about the noise\r\n騒音のことで苦情を言う"
"achieve","〜を達成する","finally achieve the goal\r\nついに目標を達成する"
"enable","（A enable B to do)\r\nAのおかげで\r\nBは〜できる","Cars enable us to move freely.\r\n車は自由な移動を可能にする"
"intend","(intend to V)\r\n〜するつもりだ\r\n〜を意図する","intend to live in America\r\nアメリカに住むつもりだ"
"obtain","〜を得る","obtain information about him\r\n彼に関する情報を得る"
"divide","(divide A into B)\r\nAをBに分類する","divide the cake into six pieces\r\nケーキを6個に分割する"
"distinguish","(distinguish A from B)\r\nAとBを区別する\r\n(=distinguish between\r\nA and B)","distinguish a lie from the truth\r\nうそと真実を見分ける"
"differ","(differ from A)\r\nAと異なる","My opinion differs from hers.\r\n私の考えは彼女と異なる"
"educate","〜を教育する","how to educate children\r\n子供を教育する方法"
"borrow","(borrow A from B)\r\nBからAを借りる","borrow a book from a friend\r\n友だちから本を借りる"
"invent","〜を発明する\r\n〜を作り出す\r\n(=make up)","invent a time machine\r\nタイムマシーンを発明する"
"promote","〜を促進する","promote economic growth\r\n経済成長を促進する"
"advise","(advise A to V)\r\nAに〜するように忠告する\r\n〜に助言する","advise him to stop drinking\r\n酒をやめるよう彼に忠告する"
"arise","(A arise from B)\r\nBからAが生じる","Problems arise from carelessness.\r\n不注意から問題が生じる"
"permit","(permit A to V)\r\nAに〜することを許す\r\n(=allow A to V)","permit him to go out\r\n彼に外出することを許す"
"recommend","(recommend A to B)\r\nAをBに勧める","recommend this book to you\r\nあなたにこの本を推薦する"
"define","(define A as B)\r\nAをBと定義する","define a day as twenty-four hours\r\n1日を24時間と定義する"
"inform","(inform A of\r\n［about］B)\r\nAにBを知らせる","inform him of his son""s success\r\n息子の成功を彼に知らせる"
"oppose","〜に反対する","oppose their marriage\r\n彼らの結婚に反対する"
"trust","〜を信用する","trust an old friend\r\n古い友達を信用する"
"select","〜を選ぶ","select the best answer\r\n最良の答を選ぶ"
"praise","(praise A for B)\r\nBのことでAをほめる\r\n［名］ほめること，賞賛","praise him for his work\r\n仕事のことで彼をほめる"
"handle","〜に対処する\r\n〜にさわる\r\n［名］取っ手","how to handle problems\r\nどう問題に対処すべきか"
"propose","〜を提案する","propose a new way\r\n新しいやり方を提案する"
"breathe","〜を呼吸する","breathe fresh air\r\n新鮮な空気を呼吸する"
"criticize","(criticize A for B)\r\nBのことでAを非難する\r\n〜を批判する","criticize him for being late\r\n遅刻したことで彼を非難する"
"overcome","〜に打ち勝つ\r\n〜を克服する","overcome the fear of death\r\n死の恐怖に打ち勝つ"
"possess","〜を持っている\r\n(=have，own)","possess great power\r\n大きな力を持っている"
"predict","〜を予言する\r\n〜を予測する","predict the future\r\n未来を予言する"
"publish","〜を出版する\r\n〜を発表する","publish a book\r\n本を出版する"
"purchase","〜を買う\r\n(=buy)","purchase a new car\r\n新しい車を買う"
"recall","〜を思い出す\r\n(=remember)","recall the good old days\r\n古き良き時代を思い出す"
"explore","〜を探検する\r\n〜を探求する","explore the Amazon River\r\nアマゾン川をを探検する"
"stare","(stare at A)\r\nAをじっと見る","stop and stare at her\r\n立ち止まって彼女をじっと見る"
"absorb","〜を吸収する","absorb a lot of water\r\n大量の水を吸収する"
"resemble","〜に似ている","He resembles his father.\r\n彼は父親に似ている。"
"tear","〜を引き裂く","tear the letter to pieces\r\nずたずたに手紙を引き裂く"
"consume","〜を消費する","consume a lot of energy\r\n多量のエネルギーを消費する"
"compete","(compete with A for B)\r\nBを求めてAと競争する\r\n匹敵する","compete with him for a gold medal\r\n金メダルをめざして彼と競争する"
